{
  "candidate_id": "cand-example-03",
  "template_id": "leverage_ratio",
  "stage": 1,
  "platform_target": "worldquant_brain",
  "artifact_state": "candidate",
  "status": "probe_blocked",
  "source_data_rights": "platform_proprietary",
  "reuse_tags": [
    "worldquant_submittable",
    "numerai_adaptable",
    "quantiacs_adaptable",
    "self_trading_research"
  ],
  "params": {
    "numerator": "liabilities",
    "denominator": "assets"
  },
  "required_fields": [
    "liabilities",
    "assets"
  ],
  "rendered_expression": "liabilities/assets",
  "rationale": "Financial Leverage Ratio：一阶段先验证基础信号是否有统计味道，重点是找到能解释、能回测的 base signal，而不是一次到位。 比率类模板适合表达结构关系，例如杠杆、盈利能力或资产质量，而不是只看绝对值。",
  "review_status": "needs_human_gate",
  "adaptation_notes": "Off-platform reuse requires field remapping and a fresh implementation.",
  "risk_notes": [
    "No platform call is allowed in dry-run mode.",
    "Any future connector use must pass a separate gate."
  ],
  "local_precheck": {
    "score": 100,
    "decision": "ready_for_manual_gate",
    "notes": [
      "Schema 完整。",
      "字段均在最小字段池内。",
      "模板匹配成功。",
      "表达式复杂度在 stage 1 预算内。",
      "数据权限被正确标记为平台专有，边界清晰。"
    ]
  },
  "status_history": [
    "drafted",
    "schema_validated",
    "locally_scored",
    "pending_manual_gate",
    "probe_blocked"
  ]
}
